chunk_id,section_id,category,heading,sub_idx,text,word_count
54,MVO-1965-Sec-72,vehicle_restriction,Vehicle Fitness Certificate,0,"Section 72 MVO 1965 requires every motor vehicle used in public service (bus, taxi, goods vehicle) to hold a valid Fitness Certificate issued by the Vehicle Examination Department. An unfit vehicle on public roads endangers other road users. Operating without fitness cert: Rs. 3,000 fine. If the vehicle causes an accident: operator liable under Section 304-A PPC (causing death by negligence).",61
55,PHC-Rule-62,vehicle_restriction,Prohibited Vehicle Types at Night,0,"Rule 62 PHC requires that slow-moving agricultural or construction vehicles equipped with adequate lighting may use rural roads at night, but are strictly prohibited from arterial urban roads between 22:00 and 06:00. Fine for prohibited night-time vehicle on arterial road: Rs. 2,000. Vehicles without functional lights are additionally subject to prosecution for unroadworthy vehicle offences.",55
56,NHMP-Reg-2022-V3,vehicle_restriction,Hazardous Materials Vehicles,0,"NHMP Regulation 2022 V3 requires vehicles transporting dangerous goods (petroleum, chemicals, explosives) to carry valid hazardous materials permits, display appropriate hazard placards, and follow designated routes only. These vehicles are prohibited from using tunnels and certain urban roads. Violation: Rs. 50,000 fine, immediate vehicle impoundment, and referral to environmental enforcement authorities.",51
57,MVO-1965-Sec-80,lane_discipline,U-Turn Restrictions,0,"Section 80 MVO 1965 prohibits U-turns at locations marked with 'No U-Turn' signs, at pedestrian crossings, within junctions, or where visibility is insufficient. An illegal U-turn often requires crossing solid white or yellow lines and thus constitutes both a lane discipline and a road sign violation. Fine: Rs. 2,000.",49
58,PHC-Rule-70,signal_violation,Seatbelt Compliance at Signals,0,"Rule 70 PHC requires all vehicle occupants (driver and passengers in front seats) to wear seatbelts at all times. Officers stationed at traffic signals routinely check seatbelt compliance. Fine for non-compliance: Rs. 500 per unbelted occupant. Children under 12 must be in an approved child restraint; non-compliance: Rs. 1,500.",49
59,MVO-1965-Sec-85,reckless_driving,Failure to Report Accident,0,"Section 85 MVO 1965 requires any driver involved in a road accident that causes injury to any person or damage to property exceeding Rs. 5,000 to stop, provide particulars to other parties, and report the accident to the nearest Police station within 24 hours. Hit-and-run is an aggravated offence under Section 279 and 337-A PPC. Additional fine: Rs. 5,000 and potential criminal prosecution.",63
60,NHMP-Reg-2022-G1,reckless_driving,Distracted Driving — Visual Tasks,0,"NHMP General Regulation 2022 G1 prohibits any visual or manual task that distracts the driver from the road, including: reading a map or newspaper, eating, applying cosmetics, or watching video on a dashboard screen while the vehicle is in motion. Fine: Rs. 1,500. Distracted driving that causes or nearly causes an accident: Rs. 5,000 and court referral.",57
61,PHC-Rule-75,speed_limit,Night-Time Speed Reduction,0,Rule 75 PHC requires all drivers to reduce speed by at least 10 km/h below the posted limit between midnight and 05:00 on roads without adequate street lighting. On unlit rural roads at night the speed must not exceed 60 km/h regardless of any higher posted daytime limit. NHMP patrol vehicles enforce this regulation on night-time highways.,57
62,MVO-1965-Sec-90,emergency_vehicle,Funeral Procession Rules,0,"Section 90 MVO 1965 requires drivers encountering a funeral procession escorted by Police to yield as they would for any escorted convoy. Cutting through a funeral procession is prohibited and constitutes an obstruction offence. Fine: Rs. 2,000.",37
63,NHMP-Reg-2022-P2,pedestrian_right_of_way,Pedestrian Refuge Islands,0,"NHMP Regulation 2022 P2 requires drivers to slow down when a pedestrian is on a refuge island waiting to complete a crossing. The pedestrian may legally cross when traffic allows; the driver of the nearer lane must give way. Passing a refuge island at speed without checking for pedestrians is careless driving. Fine: Rs. 1,500.",55
64,PHC-Rule-80,vehicle_restriction,Non-Motorised Vehicles in Motorised Lanes,0,"Rule 80 PHC prohibits cycles, rickshaws, tongas, and other non-motorised vehicles from using motorised carriageways where a separate lane or road is provided. Using a motorised lane by a non-motorised vehicle: Rs. 500 fine. Using a motorway or expressway by a non-motorised vehicle: Rs. 3,000 fine and removal.",48
65,MVO-1965-Sec-95,lane_discipline,Roundabout Lane Rules,0,"Section 95 MVO 1965 requires vehicles entering a roundabout to give way to vehicles already circulating. Lane changes within the roundabout must follow road markings. Exiting from the wrong lane is a lane discipline violation. Fine: Rs. 1,000. Causing a collision by incorrect roundabout lane use: liable under Section 279 PPC.",51
66,PHC-Rule-85,signal_violation,Railway Level Crossing Signals,0,"Rule 85 PHC requires all drivers to stop at railway level crossing gates or signals when indicated. Proceeding past a level crossing light or closed gate is an extremely dangerous signal violation. Fine: Rs. 5,000 and potential criminal charges. Drivers must also stop when they can hear or see an approaching train even if the gate is open.",58
67,NHMP-Reg-2022-H1,reckless_driving,Harsh Braking on Motorways,0,"NHMP Regulation 2022 H1 prohibits sudden or harsh braking on motorways without a genuine hazard ahead, as this causes rear-end collisions. Deliberately brake-testing a following vehicle is an act of dangerous driving. Fine: Rs. 5,000. If a collision results, the brake-testing driver bears contributory liability.",45
68,MVO-1965-Sec-100,pedestrian_right_of_way,Pedestrian Priority at Roundabouts,0,"Section 100 MVO 1965 extends pedestrian priority to crossings at roundabout entry and exit points. Pedestrians using these crossings have right of way over turning vehicles. A driver must yield before entering or exiting the roundabout if a pedestrian is on or approaching the crossing. Fine for failure to yield: Rs. 2,000.",52
69,PHC-Rule-90,emergency_vehicle,Parking Blocking Emergency Access,0,"Rule 90 PHC prohibits parking in front of fire hydrants, hospital emergency entrances, ambulance bays, or any access designated for emergency vehicles. A vehicle blocking emergency access may be towed immediately without prior notice. Fine: Rs. 5,000 plus towing costs. If the obstruction delayed an emergency response resulting in harm, criminal liability may arise under Section 283 PPC.",58
70,NHMP-Reg-2022-S3,speed_limit,Speed Advisory Signs,0,"NHMP Regulation 2022 S3 distinguishes between mandatory speed limit signs (circular with red border — legally enforceable) and advisory speed signs (diamond-shaped — recommended but not enforceable). Exceeding a mandatory speed limit: fine as per S1 scale. Exceeding an advisory speed in conditions for which it is intended (e.g., sharp bend) may constitute careless driving if an incident results.",59
